<?xml version="1.0" encoding="UTF-8"?>
<tns:library xmlns:tns="http://www.example.org/libraryScheme" xmlns:xsi="http://www.w3.org/2001/XMLSchema-instance" xsi:schemaLocation="http://www.example.org/libraryScheme libraryScheme.xsd ">
  <tns:book>
    <tns:author-ref>tns:author-ref</tns:author-ref>
    <tns:title>tns:title</tns:title>
    <tns:language>si</tns:language>
    <tns:year>1999</tns:year>
  </tns:book>
    <tns:book>
    <tns:author-ref>tns:author-ref1</tns:author-ref>
    <tns:title>tns:title</tns:title>
    <tns:language>de</tns:language>
    <tns:year>1920</tns:year>
  </tns:book>
    <tns:book>
    <tns:author-ref>tns:author-ref2</tns:author-ref>
    <tns:title>tns:title</tns:title>
    <tns:language>fr</tns:language>
    <tns:year>1500</tns:year>
  </tns:book>
  <tns:author id="idvalue0">
    <tns:last-name>tns:last-name</tns:last-name>
    <tns:first-name>tns:first-name</tns:first-name>
  </tns:author>
  <tns:author id="idvalue1">
    <tns:last-name>tns:last-name</tns:last-name>
    <tns:first-name>tns:first-name</tns:first-name>
  </tns:author>
</tns:library>
